{
	"$schema": "https://raw.githubusercontent.com/webx-net/webx/main/schemas/webx.config.schema.json",
	"name": "My todo WebX Project",
	"description": "An example WebX project.",
	"version": "1.0.0",
	"port": 8080,
	"tls": {
		"key": "path/to/key.pem",
		"cert": "path/to/cert.pem"
	},
	"cors": { "allowOrigin": "*" }
}
